{
  "approval_marker": "[PERFORMANCE-BASELINE-INDEPENDENT-REVIEW][APPROVE_PERF_BASELINE] design_id=sha256:f72e1fb439364378649b7b03db5cb7a52cf42367022cb0c6e07348a0e3659a42 result_sha256=460fffbd42bd3824984c821120151f42a0062164475811725204d4582086ce32",
  "checker_regression": {
    "kind": "bounded_checker_regression",
    "path": ".github/task-runs/2026-08-08-rv64-v15z-arch-stable-act4-rebind-f72e-a1/evidence/mainline-rebind-f72e-v1/performance-baseline/checker-regression.log",
    "sha256": "8fa509c5ebc72744fedd1418f92d378c7b03c5ee8fe44e82e32f1a1c6f4f0378",
    "size_bytes": 5736
  },
  "cleanup_receipt": {
    "kind": "cleanup_receipt",
    "path": ".github/task-runs/2026-08-08-rv64-v15x-performance-baseline-f72e-a1/evidence/performance-baseline-current/rebind-act4-v1/cleanup-receipt.json",
    "sha256": "6e53f449dfd6276b6e4f8f0464d6637ef7b98d64c2f85e17beb735e9f77dedbc",
    "size_bytes": 1354
  },
  "command_status": {
    "kind": "direct_stage_status",
    "path": ".github/task-runs/2026-08-08-rv64-v15x-performance-baseline-f72e-a1/evidence/performance-baseline-current/command-status.txt",
    "sha256": "afe73dd5c4e5467f1b0dd97d5e7686f67f1fcdc1629f84c336423f247f47451e",
    "size_bytes": 195
  },
  "decision": "APPROVE_PERF_BASELINE",
  "design_id": "sha256:f72e1fb439364378649b7b03db5cb7a52cf42367022cb0c6e07348a0e3659a42",
  "final_manifest": {
    "kind": "performance_baseline_final_manifest",
    "path": ".github/task-runs/2026-08-08-rv64-v15x-performance-baseline-f72e-a1/evidence/performance-baseline-current/rebind-act4-v1/run-manifest.json",
    "sha256": "f11c611d855317dd6bcd0126d5ad5564acc92568f9735b408f5b16d151a69bc0",
    "size_bytes": 6068
  },
  "open_blockers": [],
  "result": {
    "kind": "performance_baseline_result",
    "path": ".github/task-runs/2026-08-08-rv64-v15x-performance-baseline-f72e-a1/evidence/performance-baseline-current/rebind-act4-v1/result.json",
    "sha256": "460fffbd42bd3824984c821120151f42a0062164475811725204d4582086ce32",
    "size_bytes": 11729
  },
  "review_report": {
    "kind": "independent_review_report",
    "path": ".github/task-runs/2026-08-08-rv64-v15z-arch-stable-act4-rebind-f72e-a1/subagent-contracts/v15z-performance-baseline-act4-rebind-review-f72e-v1.result.md",
    "sha256": "5a15eb2def74a3e2e5c7ae1648f7ab5c0bdf3a0b4be8433b8f5879b5ce5c025d",
    "size_bytes": 4070
  },
  "review_scope": {
    "bit_exact_repetitions": "PASS",
    "canonical_build_and_verify": "PASS",
    "cleanup_receipt": "PASS",
    "committed_pc_boundaries": "PASS",
    "current_design_identity": "PASS",
    "cycle_and_slot_conservation": "PASS",
    "fail_closed_status": "PASS",
    "full_causal_cpi_stack": false,
    "global_workload_representativeness": false,
    "historical_result_non_rebinding": "PASS",
    "input_preflight_before_first_simulation": "PASS",
    "instrumentation_noninterference": "PASS",
    "negative_mutations": "PASS",
    "ppa": "UNQUALIFIED",
    "promotion_eligible": false,
    "scoped_workloads": [
      "coremark",
      "dhrystone_10000"
    ]
  },
  "reviewed_at_utc": "2026-08-08T06:50:19Z",
  "reviewer_contract": {
    "kind": "rtl_task_contract",
    "path": ".github/task-runs/2026-08-08-rv64-v15z-arch-stable-act4-rebind-f72e-a1/subagent-contracts/v15z-performance-baseline-act4-rebind-review-f72e-v1.json",
    "sha256": "53b640fc5d60ca8b03120fcbb22b1d5592d75195b5ef23be6eb0faf0594788c1",
    "size_bytes": 4493
  },
  "schema": "npc-rv64-performance-baseline-independent-review-v2",
  "task_run_status": {
    "kind": "fail_closed_status",
    "path": ".github/task-runs/2026-08-08-rv64-v15x-performance-baseline-f72e-a1/performance-baseline-current.status",
    "sha256": "c26de83abdc9496cd1301470918ec39ecca1cf389ef0ae1c6504da1800d1c431",
    "size_bytes": 5
  },
  "unknowns": [
    "Global integer and FP issue-slot capacity plus region occupancy remain outside this scoped baseline.",
    "The two deterministic bare-metal workloads do not establish global workload representativeness, a full causal CPI stack, or qualified PPA."
  ],
  "workflow_artifacts": {
    "checker": {
      "kind": "checker",
      "path": "npc/rv64/eval/ppa/tools/performance_baseline_current.py",
      "sha256": "288cc06add79825d883b1fff0b401140cb34880737036fdb15b1a59fa3816f84",
      "size_bytes": 96771
    },
    "checker_helper": {
      "kind": "checker_helper",
      "path": "npc/rv64/eval/ppa/tools/check.py",
      "sha256": "327ea3ad4c9d328749c0123cc614bc4bdc9769aec9f27019128e7da7ce5809a5",
      "size_bytes": 129598
    },
    "current_tests": {
      "kind": "current_tests",
      "path": "npc/rv64/eval/ppa/tests/test_performance_baseline_current.py",
      "sha256": "e23e96b5c42f1fffeff298fef777851f6571a85af261b10e5620849e061eb42e",
      "size_bytes": 23120
    },
    "direct_tests": {
      "kind": "direct_tests",
      "path": "npc/rv64/eval/ppa/tests/test_performance_baseline_v3.py",
      "sha256": "daf4958228b61521441e03e161d6e14a2d54767d70e1b4b6560868f2aec83a91",
      "size_bytes": 14861
    },
    "result_schema": {
      "kind": "result_schema",
      "path": "npc/rv64/eval/ppa/schemas/performance-baseline-current-v3.schema.json",
      "sha256": "677b7cc664f98de8eef21ca3c6cf39f988bb8b52ecba6c476d45b81e1f52624c",
      "size_bytes": 4539
    },
    "review_schema": {
      "kind": "review_schema",
      "path": "npc/rv64/eval/ppa/schemas/performance-baseline-independent-review-v2.schema.json",
      "sha256": "7f2cfcad646d6824966cdf8c9cc8987952f50c234cd9a0e11ce8e537289692c3",
      "size_bytes": 4828
    },
    "review_tests": {
      "kind": "review_tests",
      "path": "npc/rv64/eval/ppa/tests/test_performance_baseline_review_v2.py",
      "sha256": "44939c65c5237375912d384845cb46cdc6531111aa4f6e5d246c735f11cb7a20",
      "size_bytes": 9742
    },
    "runner": {
      "kind": "runner",
      "path": "npc/rv64/eval/ppa/run-performance-baseline-current.sh",
      "sha256": "e130445983f002f8824e8ddee9b77b626ff1540a6c97e13f6b8c0cb9316f5ffb",
      "size_bytes": 12046
    },
    "status_helper": {
      "kind": "status_helper",
      "path": "scripts/task-run-status.sh",
      "sha256": "43977d9787cb41cc541eafa68f1c98f5e4504684b1104398274b07bc8155b7c6",
      "size_bytes": 3357
    }
  }
}
